,name,license_type,city,county,zip
284,THE REGENTS OF THE UNIVERSITY OF CA CONSTITUTIONAL CORP ,License Type: Clinic (Government Owned),FOLSOM, SACRAMENTO, 95630
285,THE REGENTS OF THE UNIVERSITY OF CA CONSTITUTIONAL CORP ,License Type: Clinic (Government Owned),FOLSOM, SACRAMENTO, 95630
286,THE SURGERY CENTER OF RIVERSIDE ,License Type: Clinic,RIVERSIDE, RIVERSIDE, 92503
287,TOM WADDELL HEALTH CENTER ,License Type: Clinic (Government Owned),SAN FRANCISCO, SAN FRANCISCO, 94102
288,TOM WADDELL URBAN HEALTH CLINIC ,License Type: Clinic (Government Owned),SAN FRANCISCO, SAN FRANCISCO, 94102
289,UC DAVIS MEDICAL GROUP - RANCHO CORDOVA ,License Type: Clinic (Government Owned),RANCHO CORDOVA, SACRAMENTO, 95670
290,UC DAVIS MEDICAL GROUP ROCKLIN GI SPECIALTY CLINIC ,License Type: Clinic (Government Owned),ROCKLIN, PLACER, 95675
291,UC DAVIS MEDICAL GROUP ROCKLIN INFUSION CLINIC ,License Type: Clinic (Government Owned),ROCKLIN, PLACER, 95675
292,UC DAVIS MIDTOWN NEUROLOGY CLINIC ,License Type: Clinic (Government Owned),SACRAMENTO, SACRAMENTO, 95816
293,UC DAVIS SPINE CENTER ,License Type: Clinic (Government Owned),SACRAMENTO, SACRAMENTO, 95816
294,UCDMG CAMPUS COMMONS CLINIC ,License Type: Clinic (Government Owned),SACRAMENTO, SACRAMENTO, 95825
295,UCDMG ELK GROVE ,License Type: Clinic (Government Owned),ELK GROVE, SACRAMENTO, 95758
296,UCDMG MIDTOWN FAMILY MEDICINE ,License Type: Clinic (Government Owned),SACRAMENTO, SACRAMENTO, 95816
297,UCDMG MIDTOWN INTERNAL MEDICINE ,License Type: Clinic (Government Owned),SACRAMENTO, SACRAMENTO, 95816
298,UCDMG MIDTOWN PEDIATRICS ,License Type: Clinic (Government Owned),SACRAMENTO, SACRAMENTO, 95816
299,UCDMG NATOMAS ,License Type: Clinic (Government Owned),SACRAMENTO, SACRAMENTO, 95834
300,UCSD AMBULATORY SURGERY CENTER LLC ,License Type: Clinic,SAN DIEGO, SAN DIEGO, 92122
301,UCSD CENTER FOR SURGERY OF ENCINITAS LP ,License Type: Clinic,ENCINITAS, SAN DIEGO, 92024
302,UCSD SURGICAL CENTER OF SAN DIEGO LLC ,License Type: Clinic,SAN DIEGO, SAN DIEGO, 92121
303,UNITED SURGERY CENTER MURRIETA ,License Type: Clinic,MURRIETA, RIVERSIDE, 92562
304,UNITED SURGERY CENTER TEMECULA ,License Type: Clinic,TEMECULA, RIVERSIDE, 92592
305,UPLAND OUTPATIENT SURGICAL CENTER INC ,License Type: Clinic,UPLAND, SAN BERNARDINO, 91786
306,VIETNAM VETERANS OF SAN DIEGO CLINIC ,License Type: Clinic,SAN DIEGO, SAN DIEGO, 92110
307,VISTA COMMUNITY CLINIC - WEST ,License Type: Clinic,OCEANSIDE, SAN DIEGO, 92054
308,WELL OF HEALING ,License Type: Clinic,FONTANA, SAN BERNARDINO, 92336
309,WELLSPACE HEALTH ,License Type: Clinic,SACRAMENTO, SACRAMENTO, 95814
310,WIKA ENDOSCOPIC CENTER ,License Type: Clinic,APPLE VALLEY, SAN BERNARDINO, 92307
